https://steamcommunity.com/id/SupermarineMKS/recommended/227320,1, Serious software for serious people. If you care about your finances, this is a great help.  Simple and smooth interface, quick to use but surprisingly deep once you understand the underlying philosophy. Yes, the learning curve is somewhat steep---at least more  than expected at first sight. I've tried many, but this has been the expense tracker that made the difference. Once I used it I ditched all the others. Good (and very fast) customer service.  It is worth its current price. I know it is more expensive than a game, but heck, this is real life you're playing here. One of the very few programs in Steam that can actually change your future.  Highly recommended. 
https://steamcommunity.com/id/SupermarineMKS/recommended/292030,1, A game that plays like a movie; with compelling characters and intricate storyline, set in a huge world with lots of things to do and places to discover. Excellent visuals and superb voice acting complete the experience for the flagship game of a successful franchise: increasingly polished series, ending with a true masterpiece.  This game is centered on its main story, and has lots of cutscenes and dialogue. It was designed like an interactive movie with lots of rich, interesting characters and meaningful decisions. Do not expect continuous, mindless combat or a dull, weapon-collecting, inventory-centered experience.   The Witcher 3: Wild Hunt  is a game to enjoy at ease, taking time to appreciate the environment and to understand the lore. There is so much content and quests that no two gameplays will be the same. You can play for 60 hours, finish the main quest and storyline and still have half the game’s content to see.  The quests are really detailed and well thought, a far cry from mindless fetch, kill and gather missions that plague so many other games, be them action, RPG or hack and slash. Every quest in  The Witcher 3: Wild Hunt  comes together as a coherent piece of a complex universe, entangled in the politics of war, the difficulties of survival and the grim existence in a morally-ambiguous world.  Several decisions made by the player can be game-changing, and you will live to see the consequences of many of your actions, even small and unimportant-looking ones.  The Witcher 3: Wild Hunt  has different endings, depending on what you did and who you chose to help (or not).   Killed characters are gone for good, and most quests will present options that do not exactly adhere to the regular good-or-evil clear-cut paths that most other games take for granted. Not even choosing a lover will be an easy decision for Geralt de Rivia.  This is a game aimed at adults, with lots of intrigue, corruption, murder, prostitution, racism, exploitation, crime, nudity and sex. The combat animations are gory and brutal, featuring plenty of beheading and dismemberment.  The sprawling, immersive world was painstakingly created, and it shows. The attention to details is astonishing, be it the texture of an armor, the warpaint of an enemy or the design of a mountain stronghold. The lighting, shadows and water effects make for very beautiful landscapes. The only environmental effect I find not quite to my liking is the propensity for very strong winds, which shake the trees but leave the smoke from chimneys intact, thus breaking the immersion a bit. The music is adequate and sets the right tone. However, there should be more moments of silence every now and then.  The combat is serviceable and the controls could be somewhat improved, but this is not a specialized action or hack and slash game. The real-time menu for weapons, signs and bombs is quite uncomfortable, and aiming the crossbow is hard with a controller, but the responsiveness of the actions is generally good. Another thing I dislike is Geralt’s weird, jumpy death animation.  Those that want to roleplay should bear in mind that this is not an RPG, but a game with RPG elements. You cannot create or heavily customize characters, apart from clothing and some of Geralt’s skills, and you cannot―and should not―go crazy over DPS stats and numbers. This is no fault or mistake;  The Witcher 3: Wild Hunt  was simply not designed that way.  The DLCs are some of the best I’ve seen, generously adding to the main experience and providing new story arcs, places characters and equipment. Lots of Free-LC enable even more customizing options.  Gwent , the game-within-a-game, is an interesting take on minigames from previous installments of this franchise. Easy to learn, quick to play and with an interesting amount of strategy, will keep most completionists looking for cards right until the very end of the main quest.  With its few flaws and quirks,  The Witcher 3: Wild Hunt  can still be considered a masterpiece of gaming and a new classic of mixed-genre, bringing together elements of storytelling, RPGs, action and open world games.  Of course, no manmade project can ever be perfect, but you don’t criticize Picasso’s  Guernica  or Leonardo’s  Gioconda  by focusing only on their glitches and flaws. What makes a classic is both  uniqueness worthy of imitation  and the  timeless relevance  that will keep the object on sight for generations to come. Both Picasso and Da Vinci achieved that, as well as Mozart, Lloyd Wright, Shakespeare, and yes,  The Witcher 3: Wild Hunt .  For sure, one of the highlights of modern gaming and among the best games ever created.  The Witcher 3: Wild Hunt  was met with near-universal acclaim, and such reputation is well earned.  Unconditionally recommended. 
https://steamcommunity.com/id/SupermarineMKS/recommended/24980,1, An absolute improvement over ME1, altough not perfect.  Controls are completely revamped; confusing at first if you were expecting the same as ME1. The pace is quicker and the gameplay more fluid and interesting. The plot has some twists and the narrative is better. There are varoius ways to end this adventure, all different depending on what you did and how you played. You can feel the consecuences of your actions. The final mission is one of the best I've ever played: complex, dramatic, not absurdly hard but not easier either, and it will make you care for your crew and squadmates.  Story is better and richer, and the drama more polished. The game knows how to keep tension, both aboard the Normandy and in combat. The variety of missions means you'll not get bored with repetitiveness as in some other games. The music sets the ambience darker than the first game, but still top notch.  Mass Effect universe's lore keeps expanding, new characters bring alternatives and the old ones return, but with little participation. Philosophical issues keep the conversations smart for those with intellect, and nice voice acting will satisfy the impatient. Romance has now more options.  The devs got rid of the confusing inventory system in favor of a bare-bones approach to weapons that completely removes the RPG-item feel. This is not necesarily a bad thing. The character building also got simpler.  Mako exploration with its super-steep mountains is gone for good. DLC has a nicer hover vehicle, more agile and fun. I recommend getting the Digital Deluxe Edition: the extra content is worth it.  If you own ME1 and liked it, do yourself a favor and play Mass Effect 2. 
https://steamcommunity.com/id/SupermarineMKS/recommended/250320,1, Masterfully written and masterfully drawn,  The Wolf Among Us  surprises with an unique personality and original setting, combined with the developer's already well-known dramatic storytelling.  I bought this game more than a year ago and shelved it. The premise sounded interesting, but not enough to play immediately. Now that the first (and probably only) season is over, I decided to try it and discovered a very polished experience, more personal and gritty than  The Walking Dead , and also more engaging.  Art direction is simply astounding. The graphics are superb, quality-wise. Even if you don't like cel shading you have to admit the devs did a very good job, and the comic book-like drawings set the atmosphere delightfully. Sounds and music are also top-notch. The lip-sync is perfect and the voice acting professionally convincing.  Gameplay-wise, the experience is immersing and compelling. I did not encounter a single glitch, lag or bug. The controls are simple and work fine, even though I would prefer to use E instead of Q for the action sequence QTEs. Divided by episodes and chapters, it can adapt to long play sessions as well as 15-minute rounds.  Where this game really shines is, of course, the story. Drawing inspiration, direction and lore from the original books, there's much more to be seen that can be noticed at first sight. This provides a wholesome world with fleshed-out, mature characters and an interesting background, connecting seamlessly to the parent storyline. Be not mistaken, this drama is not for children. Also, be prepared for a shocking shift in the way you'll forever look at your classic fairytale characters. Many of them are here, and there's no &quot;happily ever after&quot;. Illegal drugs and magic, prostitution, exploitation, murder and a very important dose of gore and violence populate this game/visual novel/point-and-click RPG-ish adventure. If you're into dark fantasy, rough drama and noir mystery-solving detective stories, this might be right up your alley.   Tell Tale Games  at it's finest, and another very nice gaming experience. This game was met with universal acclaim and there's a reason for that.  Highly Recommended.  
https://steamcommunity.com/id/SupermarineMKS/recommended/34330,1, A polished experience with attention to details and immersive gameplay. Shogun 2 is a serious upgrade to the Total War franchise and for sure the best iteration so far.  At first the Sengoku Jidai historical period might seem confusing, with lots of names and places true to the Japanese medieval setting, but after some time the essence of TW games surfaces as strong as ever. The campaigns might get long but never boring.  The art and design is impeccably well presented, and the music is top-notch, even if somewhat repetitive when playing long sessions. The graphics are good and adaptable to a wide range of PCs. The interface is clear and beautiful, and I never encountered a glitch or bug in 70+ hours of gameplay.  The new mechanic of Realm Divide brings freshness and challenge to the stalled and/or boring mid-to-endgame, and is a very welcome feature that will divide the weak and inconsistent from the true strategists. The AI is really not that smart, and makes very illogical decisions---many times downright stupid---when playing the lower difficulties. The best experience comes playing on Hard and above, and of course the light RPG-like multiplayer avatar system.  Shogun 2 can entertain you for hours. With high replayability and infinite options, no campaign is ever the same. All DLC is worth having.  If you liked previous Total War games, this is a must own. Highly recommended. 
https://steamcommunity.com/id/SupermarineMKS/recommended/400,1, Alone in its category and revolutionary in its concept, Portal is a game that any serious gamer should play from start to finish at least once.  Simple and elegant mechanics and fluid gameplay combine with a sophisticated puzzle style, impeccable design and a dash of clever, dark humour. Only two characters populate the antiseptic world of Portal---one of them never actually speaks---but that does not substract from its well-planned drama and immersive experience.  The graphics are excellent for its time and still serviceable for modern audiences. Controls are easy and the &quot;tutorial&quot; vast and adequate. You will find yourself very soon immersed in this strange, mysterious world if you are to give it a short try.  Short by today's standards, the story is nevertheless rich and compelling. The voice acting is top-notch and the music simple but adequate.  A mandatory step in the process of understanding videogame history, Portal is a true classic that even years after its initial release never fails to deliver.  Unconditionally recommended. 
https://steamcommunity.com/id/REVVAND/recommended/550900,-1, Stay away from this garbage cash grab dying game. Gameforge is the most money hungry gaming related company that has ever existed. I've been playing this garbage game since 2009 and spent thousands of hours playing it, game used to be a lot of fun in 2009-2012 but they ruined it and their game is dying because of it. 
https://steamcommunity.com/id/REVVAND/recommended/322330,1, Hit or miss I guess they never miss HUH 
https://steamcommunity.com/id/REVVAND/recommended/33930,1, It's ok I guess 
https://steamcommunity.com/id/REVVAND/recommended/942140,1, More endings than Telltale's The Walking Dead. Very immersive game, so immersive my mom actually walked in on me while playing and I couldn't ever hear her over how immersed I was! I can strongly recommend this game to each and every one of my friends, and if you're like me and have over a decade of experience in this field then you'll get over the learning curve in no time! 
https://steamcommunity.com/id/REVVAND/recommended/334230,1, If your hatred for mankind is off the charts, get this game. Or just play the browser version because it's free. It'll be a wake up call and you will soon come to realize that you are surrounded by actual simpletons. But really, this is the best free game I've ever paid for. It can be lots of fun or it can be really frustrating. 
https://steamcommunity.com/id/REVVAND/recommended/221100,-1, dead game lmao nice one devs 
https://steamcommunity.com/id/REVVAND/recommended/218620,1, At first I thought this game was about robbing banks with friends, but then I realized that we were the ones getting robbed. Best DLC simulator on the market right now 9.5/10. 
https://steamcommunity.com/id/REVVAND/recommended/282070,1, When death awaits around every corner, you're going to have to make some tough choices. Are you going to forget about morals and just do whatever is necessary to ensure your group's safety, or are you going to go out of your way to help people in need? This game really is a masterpiece. The characters feel very genuine, they're just like you and me, they have their own flaws and strengths but at the end of the day, you have to survive. And that is not an easy task. Losing someone really feels terrible. Going out on supply runs during the night makes you feel uneasy, knowing that it might be the last time you ever walk through that door, knowing that you might never return to see your friends again and knowing that they're counting on you to come back home with a few cans of food or some medicine. 
https://steamcommunity.com/id/ruinmaster337/recommended/374320,1, 9 из 10 Это было сложно! Но &quot;Боли&quot; и &quot;Страданий&quot; испытать не удалось, 1-ая и 2-ая части сложнее. 
https://steamcommunity.com/id/espace331/recommended/17410,1, Amazing game! I very like that pure colors and such a nice and unusual (for 2008) gameplay.  EA, please, let DICE to make more games in Mirror's Edge franchise... 
https://steamcommunity.com/id/dotthat/recommended/310360,1, From &quot;Hau~ Omochikaeri~~~&quot; to &quot;USODA&quot;. Boy, that escalated quickly. Recommended if you watched the anime, but it's a great game for everyone who loves this genre. Note that you won't have to choose anything during the gameplay. 
https://steamcommunity.com/id/dotthat/recommended/409100,1, Great music, kinda short but simple gameplay. A must-have for cat fans. 
https://steamcommunity.com/id/dotthat/recommended/252950,1, My favorite part is when the other players rage-demolish all their opponents when they're losing in online matches. Otherwise, it's a pretty OK game. Pity the bots worth jack??????when playing online against others, but sometimes they're even better than the players - only in rare occasions. 
https://steamcommunity.com/id/dotthat/recommended/207610,1, Cri evrytiem. 
https://steamcommunity.com/id/dotthat/recommended/213670,1, My only problem with the game is that it's too short. Otherwise, it has the same feeling as the South Park episodes, but in a game form. This game is a must if you're a big South Park fan as there are lots of references to the episodes, so the game gets even funnier when you get all those references.  'I love you guys!' *evil Cartman smiles, Kyle and Stan are astonished by the sight* 
https://steamcommunity.com/id/dotthat/recommended/17410,1, Recommended if you like Eminem: 'knees weak, palms are sweaty' 
https://steamcommunity.com/id/glory_of_god/recommended/289070,-1, Nope Nope Nope 
https://steamcommunity.com/id/ruinmaster337/recommended/232090,1, Хорошая игра, чтобы повеселиться с друзьями! Но к сожалению мои друзья не могут позволить себе эту игру :c 
https://steamcommunity.com/id/dotthat/recommended/261030,1, Them feels. Telltale, y u do dis? Anyway, a great sequel. 
https://steamcommunity.com/id/glory_of_god/recommended/735730,1, bieda troch?, praktycznie samo farmienie.. mo?na kupi? je?li zamierzamy robi??20 razy to samo, inaczej szkoda kasy 
https://steamcommunity.com/id/glory_of_god/recommended/594060,1, Worth buying, I guess 
https://steamcommunity.com/id/glory_of_god/recommended/322330,1, We can't stop here, this is spider country 
https://steamcommunity.com/id/glory_of_god/recommended/581490,1, Motoko/10 
https://steamcommunity.com/id/marksmanozzzy/recommended/322330,1, I always thought Don't Starve would be better with friends so it was easy for me to purchase this game. It is definitely much more entertaining and fun playing with others but sometimes your friends can be the opposite of helpful; like burning the entire camp to the ground in winter or aggrivating the Treeguards because of thier beaver rampage. Regardless we always had a lot of fun playing. Like it's predecessor, it stays true to the Tim Burton esque feel and has the same survival mechanics. Definitely worth it although I do believe I did not purchase this game at full price but during a sale. Even so, I would say that it is priced resasonably. 
https://steamcommunity.com/id/glory_of_god/recommended/374570,1, That was awesome! 
https://steamcommunity.com/id/marksmanozzzy/recommended/327890,1, I was not expecting this game to have an actual story &amp; was pleasantly surprised when you're creating chaos for poor Mr. Murton. Definitely need a controller to play this game &amp; even then, it's somewhat difficult to get used to. Be prepared to flop a lot! 
https://steamcommunity.com/id/glory_of_god/recommended/374320,1, szkoda, ?e taka krótka 
https://steamcommunity.com/id/marksmanozzzy/recommended/477160,1, Co-op is probably the best way to play. Controls take some time to get used to in regards to climbing. Imo its easier to play with a controller than a keyboard, especially if you're just starting out. Well made, entertaining game that will have you wanting more squishy, drunk men adventures. 
https://steamcommunity.com/id/iamaya2/recommended/322330,1, This is a really fun game to play with friends... just make sure to coordinate yourselves... oh, and don't starve :P 
https://steamcommunity.com/id/iamaya2/recommended/421810,1, I think I have never made a public review before, so here goes nothing.  Before starting, I would like to say I won this game on a giveaway thanks to the developer promoting the game through that site, so I am unsure about the free checkbox the review asks for...   ---------------------- What I liked:  This is an RPG-maker game, and I love RPG's :) What I was able to perceive about the story  The ability to improve weapons/armor/items The ability to call upon other heroes to &quot;borrow&quot; their abilities (not sure if this is allowed throughout the game or just in the tutorial) The fact that some weapons allowed multiple hits The &quot;evalution&quot; at the end of the stage  ---------------------- What I disliked:  As soon as I tried entering the first village (right after the swamp), the game crashed ;_;  Not sure if it is Win 10 related or something like that but that should be fixed ASAP After trying to recover the game, I found that it did not make an autosave when in the world map. So, my progress since the last save spot was lost I could retrace my steps back to entering the village, but the thought of the game crashing on me again made me lose interest :(  ---------------------- Overview/Recommendation:  In a broad sense, I would recommend this game. The only thing that I found cumbersome was the game crashing on me and no recent autosave to help me out. Should the developers fix this, I would recommend the game with no reserves (or at least I could be able to play longer and improve my review)...   Hope this helps some of you make a decision :) 
https://steamcommunity.com/id/glory_of_god/recommended/262060,1, Gra, w której penetrujemy lochy.  Troch? o rozgrywce: Tworzymy dru?yn?, sk?adaj?c? z 4 spo?ród wielu bohaterów. Ka?dy pe?ni inn? funkcj? i posiada ró?ne umiej?tno?ci. Gra wymaga my?lenia, planowania i analizowania naszych poczyna. Oczywi?cie wiele z tego co si? dzieje to losowo??, ale mo?emy znacznie zwi?kszy? nasze mo?liwo?ci i wróci? z wyprawy. Powodzenie misji zale?y od ich odpowiedniego dobrania, oraz wyszkolenia.  W celu podniesienia statystyk mo?emy u?y? b?yskotek, terapii, b?d? zdolno?ci innego cz?onka zespo?u.  Kolejnym aspektem jest utrzymanie mo?liwie niskiego poziomu stresu w?ród oddzia?u, inaczej nasi wrogowie nie b?d? nawet musieli marnowa? na nas czasu. Do tego trzeba uwa?a? na pu?apki, zatrucia, krwawienia i kryj?ce si? w mroku niespodzianki. W trakcie mo?na urz?dzi? ognisko i przywróci? dru?yn? do wzgl?dnej normalno?ci, jednak nie zawsze i niecz?sto.  Misje s? ró?ne, w stylu obro osad?, zdob?d? prowiant, czy zabij bossa. Te ostatnie s? szczególnie interesuj?ce - ka?dy z nich ma unikatowy zbiór umiej?tno?ci, wi?c trzeba si? inaczej przygotowa?.  Osada, która stanowi nasze centum dowodzenia daje nam dost?p do kilkunastu budynków, które mo?emy ulepsza? i dzi?ki temu - np. zwi?ksza? ilo?? dost?pnych bohaterów, czy ulepszaj?c rynsztunek.  Pod wzgl?dem wizualnym jest bardzo dobrze. Grafika wraz z muzyk? tworz? niecodzienny klimat, niespotykany u wi?kszo?ci dzisiejszych gier. Napi?cie jest budowane przez ró?nego typu odg?osy oraz zmianami o?wietlenia, a wyskakuj?ce z mroku potwory mog? nam odebra? resztki nadziei na bezpieczny powrót do domu.   Gra?em w wersj? na Maca, gdzie nie do?wiadczy?em ?adnych b??dów i bugów, oraz na Windowsa, gdzie kilka razy mnie wywali?o bez powodu i raz nie zaliczy?o misji (nagrod? otrzyma?em, ale dalej wisia?a jako niewykonana)   Z tego co mi si? nie podoba?o to irytuj?co ma?a mapa i niemo?liwo?? jej przesuwania (w wi?kszych lokacjach ci??ko trafi? myszk? w odpowiednie pole, bo ucieka poza ramk?), oraz niektóre lochy - g?ównie z dodatku, gdzie po otrzymaniu przedmiotu, trzeba si? przez kilkana?cie minut cofa?, co jest zwyczajnie nudne.  Od siebie dodam, ?e chcia?bym zobaczy? jaki? dodatek z nowym bohaterem ( wied?min  pasuje tutaj idealnie) oraz lokacj? bardziej nastawion? na samo zwiedzanie ni? walk? co kilka kroków, bo staj? si? zbyt monotonne (zw?aszcza, gdy loch sk?ada si? z wielu d?ugich tuneli, niepo??czonych ze sob?). 
https://steamcommunity.com/id/marksmanozzzy/recommended/224480,1, Octodad: Dadliest Catch has a very charming plot &amp; is worth the awkward, sometimes tedious game play to see through to the end. Play with a controller; walking in the right direction is rather difficult on its own &amp; there are many times in which you are required to climb. It is worth it to complete the story as, imo, the best reveal is at the end.  Beware of the rogue tentacle!! 
https://steamcommunity.com/id/iamaya2/recommended/413150,1, I can say a lot of pretty good stuff about this game, but I will try to itemize:  Pros:    + Minigames are great and varied    + There is a lot of things you can do    + Each &quot;playthrough&quot; should be relatively &quot;short&quot; (there is an event after the first two years that most people count as being the end of the game, though you can keep playing. Also, you need quite some real-life hours for each playthrough)    + Good replayability since you can choose different maps for your farm and take different paths as you play  Cons:    - You will probably end up loosing some hours of sleep since time will fly while playing this game... you have been warned! 
https://steamcommunity.com/id/iamaya2/recommended/242760,1, Great game if you like putting your skills to the test. 
https://steamcommunity.com/id/glory_of_god/recommended/230310,1, gra ma spory potencja?, tylko niestety twórcy ju? jej nie wspieraj? 
https://steamcommunity.com/id/glory_of_god/recommended/598700,1, My?la?em, ?e to kolejny niedorobiony indyk, a tu mi?a niespodzianka. 
https://steamcommunity.com/id/marksmanozzzy/recommended/448510,1, I purchased Overcooked: Gourmet Edition during a Steam sale. Overall, it is a fun local co-op game but it REALLY does need online multiplayer; especially for those days when no one in the household wants to be player two. Completing a kitchen by yourself with three stars is doable but it's both more enjoyable &amp; less strenuous with more people (obviously). Definitely recommend playing with a controller vs. keyboard. Also, I would have liked to have seen additional recipe combinations &amp; kitchen layouts. I would say it currently offers less than what it could offer. I still recommend this game but am not sure it's worth the regular price without online multiplayer.   
