https://steamcommunity.com/id/HaitianVacation/recommended/431960,1, Seems pretty cool, but you have to watch which wallpapers you use because it will eat your CPU perfomance. I tried a simple rain wallpaper was using 60% of my quad core CPU. 
https://steamcommunity.com/profiles/76561198122269500/recommended/102500,1, This game is great! Very beautiful and very open world. I love the character customization and I haven't gotten tired of it. I would totally recommend this game. 
https://steamcommunity.com/id/5hreddy/recommended/452570,1, Very enjoyable. Combines multiple genres into one cohesive whole with each component feeling well designed. Great presentation, with nice art and audio. 
https://steamcommunity.com/id/HaitianVacation/recommended/404011,-1, Sega and CA you are scum.  Didn't pay for this. Steam marketplace paid for it. 
https://steamcommunity.com/profiles/76561198333302175/recommended/444090,1, this game great 
https://steamcommunity.com/id/pacoquita/recommended/730,1, bom para um??????? 
https://steamcommunity.com/id/djdeblij/recommended/1250,1, Killing Floor is a great game to play with variety of zombies 
https://steamcommunity.com/profiles/76561198333302175/recommended/105600,1, awesome game 
https://steamcommunity.com/id/djdeblij/recommended/274190,1, Gave me a hard on!!! MURICA!!! 
https://steamcommunity.com/profiles/76561198148401542/recommended/331600,1, I have been a huge One Piece fan since I started watching it, with the cool and catchy intro's and the awsome fights that the Straw Hats have had.  So when I found out that One Piece had a game I of coure wanted to play it as soon as possble and this game is a breath of fresh air, it was also pretty fun and the gameplay was pretty good.  However there are a few problems I do in fact have with the game, for starters there is no way for you to memorize the controls of the game because they give you no tutorial for the game so you are complety blind for the game, 2nd the game is a Dyansity Warriors game and I never played a single DW game at all, so One Piece Pirate Warriors 3 is a first timer for me and a game like this can in fact get a bit stale over time, the 3rd thing I should point out is that you should be at Dressrosa before playing or you might be spolled if you play ahead.  The final thing I should point out is that the game has a few differnces from the anime a few examples is that Zora is dressed differntly then he is and barry's are now beils so if small things like that don't suit you then this game may not be your cup of tea.  I recommend this game to One Piece fans and One Piece fans only like myself because if you are not a One Piece fan then you should not play this game because it's just one of those games for the fans, other then that you should 100% play this game if you like One Piece. 
https://steamcommunity.com/id/5hreddy/recommended/340170,1, Can't speak about any of issues of the latest Windows patch as I played it prior, but as for the game it was definitely a grower.  I wasn't really feeling it after the first couple of hours as the 30 fps lock and PSP-esque upgraded graphics were not doing a lot for me. But after coming back to it a couple years after first trying it I enjoyed it a lot more. Once you get past some of the issues there's actually quite a fun and diverse combat system with plenty to do alongside a decent story. 
https://steamcommunity.com/id/Ivapodx/recommended/218640,1, +++ 
https://steamcommunity.com/id/5hreddy/recommended/720280,-1, The production values are generally decent, but the story is kinda dumb. The first third or so is okay, but everything after that just becomes rushed and poorly developed. 
https://steamcommunity.com/id/Ivapodx/recommended/578080,1, prepare to run around looting houses for 20 mins then die from a bullet out of nowhere 
https://steamcommunity.com/id/spectre818/recommended/274190,1, FREEEEEEEDDOOOOOM 
https://steamcommunity.com/id/Ivapodx/recommended/359550,1, nice game with cool features + very good graphics 
https://steamcommunity.com/id/Ivapodx/recommended/566990,-1, Drunk driver simulator 
https://steamcommunity.com/id/Ivapodx/recommended/795100,1, +++ 
https://steamcommunity.com/id/Ivapodx/recommended/730,1, good luck getting skilled teammates that can speak english... 
https://steamcommunity.com/id/spectre818/recommended/511740,1,   Are you a weeb?   Do you like rail-shooters?   Do you like going around puting girls in a complex perpetual state of euphoria?   Do you want to lose all your friends and be shuned by society and be known as that guy?   If you answered yes i got a good game for you. If you answered no well... FeelsBadMan. 
https://steamcommunity.com/id/Ivapodx/recommended/12120,1, 100% childhood 
https://steamcommunity.com/id/Ivapodx/recommended/433850,1, now free to play? i payed 20$ for 150 hours... 
https://steamcommunity.com/id/spectre818/recommended/49520,1, just shoot and something will die - gaige 
https://steamcommunity.com/id/Ivapodx/recommended/254700,1, One of the best games ever made 
https://steamcommunity.com/id/jflux2000/recommended/225260,1, It is a legend of a game!  Great concept and interesting plotline 
https://steamcommunity.com/id/spectre818/recommended/48700,1, When the winged hussars arrived  A cry for help in time of need, await relief from holy league 60 days of siege, outnumbered and weak Sent a message to the sky, wounded soldiers left to die Will they hold the wall or will the city fall  Dedication Dedication They're outnumbered 15 to one And the battle's begun  Then the winged hussars arrived Coming down the mountainside Then the winged hussars arrived Coming down they turned the tide  As the days are passing by and as the dead are piling high No escape and no salvation Trenches to explosive halls are buried deep beneath the walls Plant the charges there and watch the city fear  Desperation Desperation It's a desperate race against the mine And a race against time  Then the winged hussars arrived Coming down the mountainside Then the winged hussars arrived Coming down they turned the tide  Cannonballs are coming down from the sky Janissaries are you ready to die? We will seek our vengeance eye for an eye  You'll be stopped upon the steps of our gate On this field you're only facing our hate But back home the sultan's sealing your fate  We remember In September That's the night Vienna was freed We made the enemy bleed!  Storm clouds, fire and steel Death from above make their enemy kneel       Now lets see how many people know what this is. 
https://steamcommunity.com/id/reins56/recommended/730,1, all toxic in here(: 
https://steamcommunity.com/profiles/76561198148401542/recommended/431960,1, Ok Wallpapaer Engine, not a lot to explain here but you pay 4.99 Canadian dollars to have a??????load of wallpapers to make your desktop look cool and such not bad at all in anyway which is what I use the app for.  However you can make your very own wallpapers and share them with the everyone on steam and such so it's all good and such, like I said not a whole lot to explain here but if you want an animted wallpaper then Wallpaper Engine is the perfect thing for you my friend.  Plus the price is not all that bad and the wallpapers are very well done so I recommend this software for you my friend. 
https://steamcommunity.com/id/jflux2000/recommended/218640,1, quite enjoyable 
https://steamcommunity.com/profiles/76561198148401542/recommended/584400,1, I have seen many Sonic games in my years most of them were bad and some were decent.  I liked Sonic Unleased for some reason and SG was good, but I soon stopped playing my 360 and I have not played a Sonic game in years, untill one day Sonic Mania came out and boy was this game good.  I have to honesty say this game was a blast to play as it features many of the old classic stages in the Sonic games some from Sonic 1, 2, 3 and CD with 2 new stages in the game.  The controls are pretty good and easy to use after a few mins of play time, the sound track is great and fun to listen to and the graphics give you the old classic Sonic vibe and such.  However there is one problem I do in fact have to say and it's not about Sonic Mania it's self, it's with Sonic Team.  Sonic Forces came out a few months after and it got poor reviews and Sonic Mania was made by fans of the classic games and it got much better reviews like this one, so in other words the Sonic fans can make a better Sonic game than Sonic Team and Sega at that and that is saying something, as a matter of fact that says a lot.  However I recommend this game to anyone who was a fan of Classic Sonic games and for anyone who wants a taste of the classic Sonic games.  Oh and ???? HYDRO CITY. 
https://steamcommunity.com/id/oh_Itachi/recommended/4000,1, Game is so fun with zombie survival just get it and you'll see  
https://steamcommunity.com/profiles/76561198148401542/recommended/271590,1, GTA5 is possble one of the best games I have ever played and one of the best open world games I have ever played as well because there is so much to do and so much to see.  The game lets you play as 3 characters, Michael a man who wants to retire, Franklin a gangster who wants to live the big life, and Tervor a man who is crazy and is an old friend of Michael who finds out he is alive.  The 3 team up and perform certain missions to fufill their goals and their needs ot to help the FIB to keep them alive and out of trouble, the 3 characters have special abilty's with them, Michael has the abilty which I did not used at all, it can slow down time to get a better aim, Franklin's abilty is that he can slow down time to get a better grip when driving which is very useful when ity comes to racing and driving as a whole, and Trevor's is the one I used the most as he can go into a rage that makes him do double the damage and he can tank more hits.  When you are not doing missions you can come across the many stranges and freaks throughout Los Santos as they have things for you too do and such.  The world if Los Santos is big and there is lots to do in it, you can go biking, buy a boat to ride them, get nice cars and so much more, there is a lot to do in GTYA5 and that is why I like it since the freedom it gives you, hell if you want to go and get the cops on you start a rampage.  Now as for online I have played it a bit on PC but I did manage to play a lot of it at a friends house on his Xbox one and it was good on the there but on the PC is another story as there are a lot of hackers and most of the modding is now gone due to Rock Star and Take Two due to legal actions taken on them.  All in all GTA5 is a great game single player wise and good mutilplayer when the hackers are not out to ruin your fun and such, I recommend this game to anyone who wants a great open world game and the freedom to do what ever they want in the world of GTA5. 
https://steamcommunity.com/id/spectre818/recommended/282900,1, How many Neps does it take to Nep a Nep Nep? 
https://steamcommunity.com/profiles/76561198140470480/recommended/714010,1, Useful to do some shooting warm ups before the actual gaming. Recommended! 
https://steamcommunity.com/id/oh_Itachi/recommended/218640,1, Pretty Decent Game I could say I only felt like download it because of PEWDIEPIE playing it And really suprised how cool it actually was and If you play this game don't think its gonna be Amazing its just a little starter for the next Game Lucius II so download it play it and its a good story behind it SO ENJOY ;) ;) SHIITY GRAPHICS THO because its old and????? 
https://steamcommunity.com/profiles/76561198140470480/recommended/252490,1, Fun game! Would recommend! 
https://steamcommunity.com/profiles/76561198148401542/recommended/311690,-1, Enter the Gungeon is one of those games that is like the Binding of Isaac.  It is luck based in a way, the challenge is fair and the weapons from what I here are good.  However games that are like the Binding of Isac to me don't suit me, because of one thing and well that is because of luck and what it gives you.  Should that make you not play the game?  No not in anyway, as I think some people who are reading this review might find the game really fun and I think you should give it a shot.  However if you hate games that have a luck based system then I think Enter The Gungeon is not a game for you, other then that I think you should give it a shot. 
https://steamcommunity.com/profiles/76561198140470480/recommended/437220,-1, This game has a great potential if they can get the player base increased. Maybe they should put it on sale. Recommended if the player base is better. For now not recommended. 
https://steamcommunity.com/id/oh_Itachi/recommended/440,1, TF2 is awsome but I got an Laptop so It won't run on it Pika...Pika 
https://steamcommunity.com/profiles/76561198140470480/recommended/242760,1, It’s a good game to chill amd at the same time provides some action from the cannibal/ mutant ai’s. Recommended for those who have interest in survival, exploration and base building type of genre.  Highly recommended by me. 
https://steamcommunity.com/profiles/76561198148401542/recommended/480650,1, Have you ever wanted a qucick rerun of Yu Gi Oh, GXm 5'D's, Zexal, and Arc V.  Well my friend this game has you crovered and it is one fun expernce to have and it's really fun to play through all of them and when you complete the mission you get to swap charcters and play as them, for example lets say you just beat a mission of Yu Gi Oh vs Seto Kaiba well when you beat it with Yu Gi Oh you get to replay the mission you get to play as Kabia and such.  However there are a few problems I had with the story, the first and formost thing is tag duels are not in the story mode and I don't think they are in mutilplayer at all so the duel between Yugi and Joey vs Pardox Brothers and a few others which sucks, another problem I have with the story and well the game more like it is that some of the duels can be outright BS manily cheating Exodia, that one I had a problem with the most but the rest of the duels are no problem with me, well of course besides luck been in play.  Online is sadly dead but there is a group out there that has people dedacted to play the game so you should find them there.  I recommend this game to anyone who likes the anime, card game, and Manga (which you should read 100% since you get to see all of the uncensored cards and such) of Yu Gi Oh.  Oh and Akize is 10 out of 10 wafiu. 
https://steamcommunity.com/id/HaitianVacation/recommended/298900,-1, So I came back and finally &quot;finished&quot; the campaign. Well, I finished it, but the developer didn't. This game was obviously released before it was completed because what happens at the &quot;end&quot; when you complete the last level is absurd and stinks of them literally not completing the game and just releasing it anyway. They put effort into the story in the campaign, but towards the end it abruptly stops. I've never played a game like this where it suddenly just ends without explanation or even credits. This game isn't finished. Numerous bugs such as getting achievements for finding secrets when the game clearly says I didn't find them all in the UI. Where skills for classes that were patched in after official launch have no description so you have no idea what they even do and I'm seeing weapon descriptions not in English, but Spanish......  The graphics and gameplay of this game is fun, but it's not a finished game. The art of the Space Hulk, the weapons, the Terminators, and the enemies are all fantastic. Visuals and atmosphere this game nails perfectly. Apparently they are working on an &quot;enhanced edition&quot; with customization and features that game was designed to have. Who knows when that is coming.   Stay away from this &quot;game&quot;. Even as a huge fan of Warhammer 40,000 I can't recommend this unfinished game unless you can find it under $20 for a sub 10 hour playthrough and forget it. This game had so much promise, but was rushed out with very little content and incomplete.   I still literally can't even about that &quot;ending&quot;..... 
https://steamcommunity.com/id/HaitianVacation/recommended/552500,1, Ha!  The Strangler stranglers no more....   
https://steamcommunity.com/id/jflux2000/recommended/489520,1, Recommend. Simple yet fun and intuitive 
https://steamcommunity.com/id/HaitianVacation/recommended/581030,-1, Literally Cancer. 
https://steamcommunity.com/profiles/76561198140470480/recommended/107410,1, If you're looking for a military simulator then Arma 3 is your best bet. Realistic gameplay. Great graphics and sound effects. Lots of gameplay modes available. Would definitely recommend! 
https://steamcommunity.com/profiles/76561198769963384/recommended/218640,1, I bought this game when it was discounted, but this game is pretty good at the most part. Even though its been a minute since the game has came out, its still pretty fun and rewarding for each person you murder. 
https://steamcommunity.com/id/JaredCat/recommended/508290,-1, This game is pretty much just a very crappy space invaders implementation. Has no achievements. Gets very boring quickly. 
https://steamcommunity.com/profiles/76561198140470480/recommended/221100,-1, DayZ has the potential to be a great game. It has great gameplay but too bad the developers are taking too long to work on it.   I would only recommend this game if the developers are working faster on completing the game. Yes its an Early Access Game but its taking too long. Almost 3 years and not much to shout about. 
https://steamcommunity.com/profiles/76561198148401542/recommended/254700,-1, I have always wanted to play Resdient Evil 4, and I wanted to play this game so badly.  I am giving a negative review simply because the games FPS on the PC are bad, that could be because of Windows 10 because I heared reumors that the game does not run well on it and such, so that could be the problem.   Another problem I faced is the lip sync is dealyed when it's on the cutscenes so that makes everything slow and such.  The gameplay from what I seen however is pretty great and I think Resdient Evil 4 is a great game, but this port is not, get it for the GC, Will, PS2, or any of the consloes that has this game. 
https://steamcommunity.com/id/HaitianVacation/recommended/324800,1, Somtimes sexy money.......  This game brings fun back to the FPS genre. 5 times more unique enemies and weapons than your average big budget FPS game these days. The only con of this game is having to pick which weapons to use. Tons of pop culture references, Easter eggs, and secrets. Classic Wang attitude.  More Stan Bush. More melee weapons. More gore. More explosions. More fun.  Flying Wild Hog is the only ones making legit good FPS games these days. No paid loot boxes. No season pass paid DLC. No paid DLC period! The good old days of gaming. 
https://steamcommunity.com/id/JaredCat/recommended/248490,-1, This game sucks no movement keys (WSAP), you have to click the mouse to move. 
https://steamcommunity.com/profiles/76561198424209837/recommended/720280,1, Honestly this is the best game I've played personaly. I downloaded Fox Hime Zero on my phone about 2 days before figuring out that I was playing the 2nd game. So I downloaded this and just thought it was great. (I almost cried legit) 
https://steamcommunity.com/profiles/76561198140470480/recommended/431960,1, I never regretted purchasing to spice up my dull desktop. Tons of different animated wallpapers to choose from the workshop. Recommended! 
https://steamcommunity.com/id/MrCharmy/recommended/391540,1, One of the best indie titles out there. 
https://steamcommunity.com/id/JaredCat/recommended/599090,-1, No idea what I’m supposed to do, this game has a tutorial but it is unclear. Has no achievements. Gets very boring quickly. 
https://steamcommunity.com/id/MrCharmy/recommended/237850,1, A hidden gem of the videogame industry. A must play regardless if you like adventure games or not. Just don't make the mistake of skipping the first two games just cause they're old and not as pretty. The story is fantastic and the universe is creative and well thought out. You'll not regret it, I guarantee. 
https://steamcommunity.com/profiles/76561197970566534/recommended/274190,1, Quite simply BRILLIANT!!!   Since the glorious days of Commodore 64 games I knew, that it  doesn't need much for a game, that is just pure FUN (quite like &quot;The Great Gianna Sisters&quot;)!!!   It doesn't need a state of the art graphics-engine, not the slightest bit a novel-like story or featuring mastermind puzzles to solve...   Just give me a pixelated graphics-engine, kicka$$ rocking tunes and a story that seems to be from every 80's movie with Schwarzenegger and Stallone... WHAT DO YOU GET?   BROFORCE! Me Likey! 
https://steamcommunity.com/profiles/76561198148401542/recommended/748360,1, Himiko Toga is a top tier wafiu. 
https://steamcommunity.com/profiles/76561198140470480/recommended/218620,1, Exciting game. Recommended. 
https://steamcommunity.com/id/MrCharmy/recommended/431960,1, lmao they made the harry potter moving images into a real thing 
https://steamcommunity.com/id/JaredCat/recommended/862300,1, You get what you paid for, 5K achievements at minimum price. If you’re an achievement hunter looking to increase the number of achievements on your profile showcase, then I highly recommend buying this. Else don’t waste your money. This is not a game, it’s just a way of distributing achievements. 
https://steamcommunity.com/id/MrCharmy/recommended/6310,1, A must play if you wanna play Dreamfall: The Longest Journey and Dreamfall Chapters. And believe me, you WANT TO. 
https://steamcommunity.com/profiles/76561198140470480/recommended/730,1, Would recommend. 
https://steamcommunity.com/id/Menime_/recommended/462770,1, This game is the third game by Supergiant Games, makers of Bastion and Transistor. This game has fantastic writing and character development outshining both their previous games. I believe it was also the longest of the three games. If you are a fan of story in video games, this is the video game you want to pick up for 20$.   For some positives as I do not want to spoil anything in particular. The world feels real and lived in. Every part of this world is interesting and beautiful. The art design is gorgeous even for Supergiant. Every single character feels like someone, no one is merely a throwaway. Parts of the game even made me start to tear up. the writing is amazing and has that classic Supergiant ending, where the ending can be seen in an equally optimistic or pessimistic light. Most importantly with Supergiant games the soundtrack is consistantly better than their previous titles. After finishing the game I even purchased the soundtrack just to support the development team even further.  For the negatives of the game. There is only one as I see. The gameplay is, in my opinion, significantly worse than both Bastion and Transistor. It is a strategy-esk gameplay style where you manage 3 different characters. While on paper it sounds interesting, in reality it is nothing more than a 3v3 dodgeball/basketball type expereince with slight character variations. Personally I didn't HATE the combat, but compared to that of their previous games it is nothing to praise.   Overall, I highly recommend this game to those people who love story and narrative and are willing to sarifice gameplay for it. If you like any Telltale type game, it's practically that with more gameplay. In case you, Reader, are wondering how overall this stacks up to Supergiant's previous outings, I say this game is slightly worse than Bastion merely because Bastion's gameplay is phenominal, elsewise this game does have better narrative and charatcer in my humble opinion. Meanwhile this game is better than Transistor, because Transistor's falls short in the narrative department heavily and suffers from a combat system that some have called 'clunky'. While I am not saying any of these games are bad or even eh, I love all three of these games and their AMAZING soundtracks, the order in which I would say in quality is Bastion&gt;Pyre&gt;Transistor.   If this review was helpful to your decision to purchase this game I am glad I could be of use. May the Scribes favor you Reader.  Update: I played this game 5 months ago and still have been listening to the soundtrack! 
https://steamcommunity.com/id/MrCharmy/recommended/292030,1, &gt;has big birbs &gt;is good gaem 
https://steamcommunity.com/id/Menime_/recommended/431960,1, It's 4$ you cheap bastards just buy it and watch anime girl boobs jiggle on your desktop already ffs 
https://steamcommunity.com/profiles/76561198140470480/recommended/578080,-1, Full of cheaters/ hackers. 
https://steamcommunity.com/id/JaredCat/recommended/859700,1, You get what you paid for, 5K achievements at minimum price. If you’re an achievement hunter looking to increase the number of achievements on your profile showcase, then I highly recommend buying this. Else don’t waste your money. This is not a game, it’s just a way of distributing achievements. 
https://steamcommunity.com/id/MrCharmy/recommended/413150,1, Addicting as hell, fun as fucc 
https://steamcommunity.com/id/JaredCat/recommended/105600,1, Fun game 
