https://steamcommunity.com/id/YuriShadows/recommended/310080,1, This is a game that I have recommended to a lot of my friends, and they've all loved it as much as I have. It has a silly premise, but it's a really enjoyable game.   What really makes this game so great (besides finally making your dream of having a bird boyfriend come true) is the true ending. I wouldn't want to spoil too much because the less you know the better it will be, just prepare for the game to take a turn.   The game goes cheap in the sales so you can force all of your friends to love birds as much as you do. I mean, who wouldn't want to spend hours arguing over who is the best bird boy?    tl;dr Moa is a genius. Get out there and date pigeons. Make all your friends date pigeons. All hail our bird overlords! Coo coo! 
https://steamcommunity.com/id/ribose5/recommended/49520,1, This game is addicting, appearently moreso the more time you spend playing. If you play with friends it's even more fun! It has great DLC, story, characters, and humor. All of these things make this game extremely replayable for me. Also this month (started mid-Oct 2013) has daily targets which gave me something to spend more time doing  (www.borderlands2loothunt.com) . For mature audiences, it's BADASS. &quot;NEVER STOP THE KILLING! NEVER!&quot; -Krieg 
https://steamcommunity.com/id/KazuoShingo1/recommended/440,1, This is my review for Team Fortress 2, and for my badge  - Good - Playable - Memes 
https://steamcommunity.com/id/ribose5/recommended/282800,1, This might be a hard sell for some friends of mine, but I've spent over a thousand hours on this game because it's a fun little time-waster in multiplayer with a decent amount of strategy involved. It's also cute. But, at the same time, the developers update it with content every few months, showing their absolute dedication to bringing players back. It's a board game that will either ruin your friendships, or if you can tolerate a salty diet, make them.  All DLC adds content but it's not required to get it to enjoy the game. Most DLC are character packs that provide two characters which tend to offer a very unique strategy, especially more lately. It's all about the high-risk high-reward characters for me. There are also DLC packs that add voices, which are not required but are certainly something to get on sale for a little flavor. Point is, all other cosmetics are free and are gotten by playing more matches and receiving them through in-game stars, oranges, or events that last a month every season. The base game without DLC gives you access to 12 characters (and 6 enemy characters, but they're just gimmicks and not very good), unlockable by playing. 
https://steamcommunity.com/profiles/76561198041528015/recommended/416380,1, This is, hands down, one of my favorite bullet hell games so far!  The player can choose between 4 ships with different shot patterns and stats. There are also 2 unlockable ships that seem to have the same stats as existing ships.  The ship controls in this vertical shoot 'em up are highly responsive, with a Touhou-style focus/slow button that allows for precise movement. Aside from the main shot, there are secondary weapons that can be useful in certain situations, and the Baryon Laser, which is explained below.  The main gameplay can be summed up as following: - shoot enemies to fill up the Baryon Laser gauge - when the gauge is full, activate the Baryon Laser - this turns enemies and bullets into items that fill the Grabuster gauge when collected - after some time, you enter Grabuster mode, which lasts until the gauge depletes  In Grabuster mode (or Gravastar, the translation is inconsistent), the ship is surrounded by what looks like a small black hole, and turns into a weapon that can be moved quickly across the screen, while damaging everything it touches. The above cycle is tied into the score system, and you can maximize your score by planning when to activate the Baryon Laser, when to pick up items that fill those gauges, and by prioritizing certain targets over others in Grabuster mode (-&gt; increase the multiplier before destroying larger enemies that are worth more points).  Getting hit activates a shield for a few seconds, and prevents you from losing a life at the cost of some Baryon Laser energy, if you have enough. However, this is risky and worse than using the gauge for the Baryon Laser, so it's more of a safeguard with a major drawback.  The patterns in this game are very basic, consisting of aimed and static shots / bullet clusters, which sometimes rotate or expand slightly. So it's less about memorizing fancy bullet patterns, and more about navigating quickly through static bullet patterns while avoiding or guiding aimed shots, and trying not to get cornered by dense bullet curtains. The colorful bullets can be easily distinguished from the background, with some rare exceptions. To make things more interesting, the game encourages horizontal movement by making the stage slightly wider than the play area, and with visible or hidden ground targets that provide items or collectibles.  The bosses are basically floating platforms with a main core, and attack turrets as optional targets. While the bosses themselves aren't very unique, the fights are somewhat interesting because the player has the option to either play it safe, or destroy all turrets, which will spawn sets of stronger turrets, and allows for a higher score.  With 12 stages, the game is quite long for an arcade shoot 'em up, and there's an entire second loop with more difficult stage variants in Arcade mode, while Story mode offers plenty of dialog, and some lengthy unlockable endings.  The story centers on a squad of 4 pilots, who have to face a fearful enemy, and deal with a conspiracy, which is complicated by the role and background of each pilot, and by some outsiders that become involved later. There are some anime cliches, along with US / Hollywood cliches, and some explicit language, reminding me a bit of Black Lagoon. ;) I generally liked the story, especially for setting the mood or making me care about the characters, though sometimes it was a bit hard to follow (mediocre translation / alternate drawing style in endings), silly, or overly dramatic.  Apart from Story and Arcade mode, there's also a practice and a caravan mode. If that's not enough, a DLC with 4 additional stages / 2 loops and another story mode can be purchased.  What makes this game great IMO is the unique gameplay which ... just feels right as a whole, just like the gameplay in Eschatos, Crimzon Clover, Trouble Witches or Murasaki. It's hard to explain, so I'd recommend to just try the demo. ;) In addition, I'm completely addicted to the soundtrack, which was the reason why I bought the game in the first place. :)   However, the game has some considerable flaws: - no graphic settings besides window / fullscreen (only 1280x720) - either vsync with noticable input delay, or no vsync with noticable screen tearing, no in-game vsync option - w/o vsync, game may set the framerate to the monitor refresh rate (e.g. can run at 144 instead of 60 fps) - mediocre English translation - small main game area in case of non-widescreen monitor - in rare cases, the game freezes for a moment - no replays - 8 achievements seem to be unobtainable(?) - the Start button on a gamepad cannot be remapped  While many of those should be fixed, it doesn't affect my experience too much: Window mode works for me, I don't mind the screen tearing or changing the monitor refresh rate, I'm usually not able to get all achievements in a bullet hell game anyway, and the freezes are rare and hardly affect gameplay. What bothers me most is that the main game occupies only a small area of my non-widescreen monitor, but it's still highly playable thanks to the excellent bullet visibility, except for higher difficulty levels where it can become a pain.  It's also noteworthy that the game has unlimited continues, and using a continue does not reset the score. There's a reward for avoiding death, but there doesn't seem to be a strong penalty for dying a lot compared to dying once during a boss fight, and I wouldn't be surprised if this could be slightly exploited. I'm not an expert, though, and I don't know how much potential for a boring exploit there is. If this bothers someone, there's at least the option to refuse to continue, and ignore scores that don't have a zero at the end. 
https://steamcommunity.com/id/KazuoShingo1/recommended/282800,1, A fun game to have with friends, but you might end up losing them :( 
https://steamcommunity.com/id/KazuoShingo1/recommended/390730,1, There are 2 reasons why you bought this game, for the extra character in 100% orange juice or for the game in general. I bought this game for both and I am enjoying it. Was worth it. 
https://steamcommunity.com/id/wudotis/recommended/440,1, THIS GAME IS AWSOME!!!!!!!!!!!!! 
https://steamcommunity.com/id/BooCakie/recommended/589360,1, A pretty ok game. Worth it at 50% off. Did the new pokemon finding system of combat before the new pokemon 
https://steamcommunity.com/id/YuriShadows/recommended/282800,1, One of my favorite games on Steam even after all these years.  The game is constantly updated releasing new characters, cosmetics, maps, campaigns, and events.  While it may have a lot of rng to it, it's hard to get seriously mad at it with how cheerful, colorful, and casual the game is.  It has a lot of wonderful characters that it'd be pretty hard to not find one that you love &lt;3 
https://steamcommunity.com/id/YuriShadows/recommended/415850,1, The game is pretty short. Only takes about 1-2 hours to finish it.  While the story isn't anything amazing, it is still pretty interesting and fun to go through. It has plenty of endings (Many of them are pretty much the same), The music is pretty good, and I adore the artwork.  For the price, I think it's a great game, that you should play if you're looking for something short and interesting. 
https://steamcommunity.com/id/BooCakie/recommended/406150,1, A pretty ok game 
https://steamcommunity.com/id/KazuoShingo1/recommended/381210,1, After picking up this game only a month ago, I can honestly say, &quot;they did a pretty good job so far.&quot; (No Sarcasm intended)  Would recommend to anyone who like to be chased or hunting people 
https://steamcommunity.com/id/petskuletsku/recommended/8930,1, 8:02 am -Just gonna play few turns 5:31 pm -Finally my nuke is ready and i can win. 
https://steamcommunity.com/id/ImmortalsM/recommended/578080,1, 新版本太好玩了，你没有体验过的全新版本，点一下玩一年，装备不花一分钱，男人想要的全都有 
https://steamcommunity.com/id/petskuletsku/recommended/474960,1, Well made game with unique concept. 
https://steamcommunity.com/id/mav_ka/recommended/8870,1, эТО ПРОСТО НЕЧТО 
https://steamcommunity.com/profiles/76561198041528015/recommended/429700,1,   Disclaimer:  A number of players reported a bug where they can't play the game, because they get a black screen when trying to start a new game. I didn't encounter this bug, but if you buy the game, I recommend to check if there's a problem, so you can refund the game withing 2 weeks of purchase if necessary.    Squirbs is a platformer with an interesting twist: You control two characters at the same time, which will respond equally to your inputs. So if you jump, both characters jump, and if you move right, both characters move to the right. For each character, there is a crystal shard in each level, and you need to get very close to them with both characters at the same time to finish a level.  The levels can feature some simple puzzle elements like crates or switches, but usually the actual puzzle involves planning a path for both characters, moving one character freely while the other one is blocked by a wall, preventing one character from jumping by pressing &lt;jump&gt; while that character (but not the other one) is in the air, planning when to best switch your focus between both characters, and so on. Later levels introduce teleporters, surfaces that influence your movement, and other interesting level elements.  The controls are responsive, and you move / stop as soon as you press or release a button or keyboard key. Jump height can be controlled precisely by releasing the &lt;jump&gt; button/key sooner or later. The only thing I don't like here is that you can't jump while holding &lt;down&gt;, but I only remember one level where that became relevant, and I beat it after adapting my strategy.  So, is this a good game? Well, I greatly enjoyed this game, and would definitely answer that with a 'yes' for me! :)  However, there are two important things to consider:   1) The platforming in this game becomes very technical / difficult starting after world 1 of 4, requiring you to make precise inputs in order to avoid a mistake that means instant death, so it becomes comparable to Super Robot Jump Jump, Super Meat Boy, I Wanna Be The Guy, the bonus levels in the Escape Goat games, or Kaizo Mario World. However, there are no hidden traps, and each level consists of a single screen and takes less than a minute (often only a few seconds) if you don't make any mistakes, so it's still very much doable for ambitious players.  2) The game is a bit unpolished: Gamepads are supported via XInput, but you can't navigate the options menu with a gamepad, or use it to skip a story screen that you will only see once / the intro screen. Also, if you have a smaller resolution (I think the game is designed with 1080p in mind), the downscaling doesn't look as nice as it could, and button icons or numbers are sometimes hard to recognize. Another thing I noticed is that physics don't seem to be 100% deterministic on a slower PC, so it can happen that one character is a pixel further to the right than the other character after walking half a screen width, despite a symmetrical level layout. However, this was only rarely a cause for failing, so it was mostly negligible for me. I was also a bit disappointed that there was no ending, but at least there's some satisfaction thanks to the achievements for completing it.   Some other reviewers claim that it becomes just mindless trial and error after some point. I can not confirm this: For example, the wall jump mechanics that can be found later are implemented in a clever way where you vertically jump if you press the jump button (no directional buttons required) while adjacent to a wall. A smart player will make use of the option to wall jump without moving the other character, while a player that relies on mindless trial and error will fail in many situations where such subtleties are relevant for success. So thinking is definitely rewarded. ;)   ------------------------------------------  If you like frustratingly hard games and can look past those flaws, or like to try out games with an innovative concept, I think it's definitely worth it.  Also, if you waver because of the high difficulty, you can still consider picking it up and just play world 1 when the game is at a discount that justifies something between 30 minutes and an hour of playtime. 
https://steamcommunity.com/profiles/76561198041528015/recommended/282800,1, 100% Orange Juice is a fantastic online boardgame for up to 4 players, with characters from the developer's other games (Suguri/Sora series, QP/Xmas Shooting series, Flying Red Barrel, 200% Mixed Juice).  The game has a silly over-the-top humor, with seagulls that fly across the board to attack other players, a hamster-like character that speaks in a foreign language and likes to rob others, and a female Santa Claus with rabbit ears who fends off attackers by hitting them with her present bag. In short: It's a lot of fun, unless you somehow hate anime, or cute characters.  What I like the most about this game (aside from the humor) is its perfect balance between strategical depth and RNG: On one hand, analyzing the parameters over which the player has control can be quite interesting, and you can spend a lot of time with meta analysis, if you like doing this. On the other hand, there are a lot of things that are outside the player's control. While you can gain a bit of an edge with smart decisions, you're still at the mercy of the RNG. Put together, this makes for a game that can be enjoyable for both strategists and casual players, without being too onesided. And if you like roguelikes, you're probably happy to read that the game can throw you in a lot of different situations, where you have to improvise with the &quot;items&quot; (cards) on your hand in creative ways, or make an educated guess.  At its core, the game is quite simple: Players take turns, and roll a D6 to move forward on the board, and the panel they land on determines if they gain or lose stars, draw a card, or if other things happen. Players can also battle other players, allowing them to steal their stars and gain points if they KO them. To win, players need to level up a certain number of times by landing on a player home panel with the required stars or battle points.  While this may sound a bit boring, there's much more beyond this. First of all, the game has a very interesting deck mechanic, where players create or choose a deck of 10 cards before the start of a game. However, the cards from all players are shuffled into a common deck. So, to build an efficient deck, you can't just add cards that are good for your character; you also have to consider how bad (or good) it is if other players draw those cards, which, btw., is the far more likely outcome with 4 players. The cast of characters is quite diverse, with each character having different stats, an exclusive hyper card that (usually) only this character can draw, and sometimes a passive ability. The character diversity results in very different playing styles or card synergies, which keeps the game fresh.  The battle system is simple, yet elegant: The challenger rolls a D6 for attack, and the challenged player chooses to defend or evade, before rolling a D6. Then roles swap, and the challenged player is allowed to counterattack. The rolls are modified by the character stats, potentially played start-of-battle cards, and sometimes other factors. Since character stats are very small numbers, it's possible to estimate the risk of challenging another player quite well, except for potential cards that the other player may play.  Now, the battle system is a bit more than just a gimmick thrown into the game for some forced chaotic interaction: Some characters are good attackers, while others are good defenders, or star gatherers (which is a bit of an oversimplification). In addition, characters pose more or less of a threat depending on their HP, card hand, character level, board position, and how much they need your stars. Sometimes it's safer to attack someone, because passing them would allow them to attack first. Sometimes, you want to attack someone, because it allows you to stop on their panel. And sometimes you don't want to pass another player, because you know the other player will attack you to land on your panel.  There's a lot more to say about the game mechanics, like thoughtful pathing, resource management (cards vs stars), and the many ways cards and active events have an impact on the game. Figuring out how to build a good deck for certain characters, or to play them well can be an interesting, non-trivial challenge.  But, as mentioned at the beginning, there's only so much that a player can influence: While the game has a lot of depth, playing well is often countered by bad luck, and vice-versa. If you expect that the best player wins, this is not the game for you. If you enjoy meta analysis, and are pleased to win slightly more often if you play well, you might enjoy this game. And if you just want to have some silly fun while chatting with other players, without having to think too much about the deeper aspects, this game has you covered.   While the game has a singleplayer mode, I mostly played it to unlock some things, for a challenge, and to try out things offline. The AI is very limited: It gets most of the basic things right, but plays cards completely randomly, and makes poor risk management decisions. In the singleplayer campaign, the difficulty setting determines how much the AI player rolls are rigged (the final boss even makes a comment about this ^_^). You can get some enjoyment out of singleplayer mode, but it probably won't last long.   The developers / publishers seem to care a lot about the game, are active on the community boards, and keep updating the game with bug fixes, new characters and voices, or seasonal events with special rules and obtainable cosmetics, and so on.  My experience while playing with strangers has been good -- particularly during seasonal events -- and finding new friends to play with isn't difficult with this community.  Regarding DLC: There is a lot of DLC, but IMO the only essential DLCs are the two card packs. The (Japanese) voice packs are worth it as QoL features, if you care about this. For new players, the base game already has a lot of characters (18, some of which have to be unlocked). So the character DLCs aren't necessary, and I exclusively played base game characters for a long time, even though I owned some of the DLC characters (which often are a bit more difficult to play for someone who is new to the game). Note that two character DLCs (Breaker &amp; Witch Pack) add a new campaign, each, in case this is important for you. While I ended up buying all DLC, I did it because I wanted it, and not because I felt I needed it to enjoy the game, and because I wanted to support the developer / publisher.  The only two bad things I can think of off the top of my head (ignoring minor issues) are: 1) The manual is outdated, confusing, and contains a crucial mistake that caused me to misunderstand one of the core mechanics. But there's a good beginner's guide on Steam, and the game has a link to an extensive wiki. 2) It takes some time to unlock all cards and characters. I personally don't care about the latter, but I found it a bit annoying that I couldn't just freely build my deck for a tank character, until I unlocked several rare HP recovery cards, which are more or less mandatory for such a character. 
https://steamcommunity.com/id/BooCakie/recommended/435150,1, Still have not beat it. I got to be a perm chicken zombie. 
https://steamcommunity.com/id/BooCakie/recommended/499520,1, Quality game, genuine hard puzzles that make you thunk 
https://steamcommunity.com/id/BooCakie/recommended/582010,-1, I bought the Deluxe Edition of this game and got what amounted to nothing with it. The day of release they have a TON DLC that should have been for those who bought the Deluxe Edition. The game is great but I have to thumbs down for this terrible business tactic. 
https://steamcommunity.com/id/BooCakie/recommended/575291,-1, &quot;Preorder exclusive&quot; my???? 
https://steamcommunity.com/id/ImmortalsM/recommended/530890,1, 原本是为了看奶子入的，玩了一下感觉还行，作为解密游戏是过关的。 从白区的解密来看，解密难度一般   白区应该是新手关卡，后面的我也没玩，也许后面的解密难度挺高  ，就是跳跃太屎了，脚一滑就下条命见，经常被门框挡一下就掉坑里了  为了捡那12颗子弹死了不知道多少次，然后发现那个机器人根本不用打的，直接绕都能绕过去，机器人连我屁股都摸不到  而且限制存档次数，都不敢乱存档的，挂了就要重打半天 打折19块，我觉得是值的，推荐 
https://steamcommunity.com/id/mav_ka/recommended/43160,1, God game 
